{
  "schema_version": "context_packet_request.v1",
  "request_id": "req_01J0ACR001",
  "goal": "Add repository-scoped ACR credentials",
  "repository": {
    "slug": "full-chaos/dev-health-acr",
    "remote_url": "https://github.com/full-chaos/dev-health-acr"
  },
  "scope": {
    "branch": "main",
    "commit_sha": "22e472d",
    "task_ref": "CHAOS-2924",
    "files": [
      "internal/auth/token.go"
    ],
    "time_window_days": 90
  },
  "options": {
    "requested_categories": [
      "state",
      "pressure",
      "cause",
      "evidence",
      "action"
    ],
    "max_items": 30,
    "max_output_tokens": 4000,
    "max_serialized_bytes": 262144,
    "include_debug": false,
    "include_low_confidence": false
  },
  "client": {
    "name": "acr-mcp",
    "version": "0.1.0",
    "sidecar_version": "0.1.0"
  }
}
